"player_name","full_name","country","format","matches","innings","total_runs","highest_score","not_outs","average","total_balls","strike_rate","fifties","hundreds","fours","sixes"
"AD Mathews","Angelo Davis Mathews","Sri Lanka","t20s",69,69,1343,81,20,27.41,1163,115.48,6,0,87,45
"AK Perera","Angelo Kanishka Perera","Sri Lanka","t20s",5,5,59,16,0,11.8,68,86.76,0,0,5,1
"AM Fernando","Asitha Madusanka Fernando","Sri Lanka","t20s",3,3,11,10,3,11,6,183.33,0,0,2,0
"N Pradeep","Aththachchi Nuwan Pradeep Roshan Fernando","Sri Lanka","t20s",4,4,10,8,3,10,15,66.67,0,0,1,0
"BAW Mendis","Balapuwaduge Ajantha Winslow Mendis","Sri Lanka","t20s",6,6,8,4,3,2.67,18,44.44,0,0,1,0
"BKG Mendis","Balapuwaduge Kusal Gimhan Mendis","Sri Lanka","t20s",99,99,2438,86,10,27.39,1949,125.09,19,0,215,92
"BMAJ Mendis","Balapuwaduge Manukulasuriya Amith Jeevan Mendis","Sri Lanka","t20s",15,15,207,43,5,20.7,186,111.29,0,0,18,6
"B Fernando","Binura Fernando","Sri Lanka","t20s",7,7,43,20,4,14.33,49,87.76,0,0,3,1
"BOP Fernando","Bodiyabaduge Oshada Piyumal Fernando","Sri Lanka","t20s",6,6,128,78,2,32,120,106.67,1,0,11,4
"CK Kapugedera","Chamara Kantha Kapugedera","Sri Lanka","t20s",36,36,675,50,6,22.5,589,114.6,1,0,56,24
"C Karunaratne","Chamika Karunaratne","Sri Lanka","t20s",33,33,272,24,16,16,266,102.26,0,0,13,11
"C Wickramasinghe","Chamindu Wickramasinghe","Sri Lanka","t20s",3,3,14,6,3,14,11,127.27,0,0,2,0
"CBRLS Kumara","Chandradasa Brahammana Ralalage Lahiru Sudesh Kumara","Sri Lanka","t20s",5,5,10,4,2,3.33,11,90.91,0,0,2,0
"CAK Rajitha","Chandrasekara Arachchilage Kasun Rajitha","Sri Lanka","t20s",8,8,31,9,6,15.5,61,50.82,0,0,2,0
"CRD Fernando","Congenige Randhi Dilhara Fernando","Sri Lanka","t20s",5,5,25,21,0,5,28,89.29,0,0,4,0
"DPMD Jayawardene","Denagamage Proboth Mahela de Silva Jayawardene","Sri Lanka","t20s",52,52,1462,100,11,35.66,1144,127.8,9,1,168,33
"DM de Silva","Dhananjaya Maduranga de Silva","Sri Lanka","t20s",44,44,786,62,5,20.15,723,108.71,2,0,68,15
"N Dickwella","Dickwella Patabendige Dilantha Niroshan Dickwella","Sri Lanka","t20s",26,26,480,68,1,19.2,374,128.34,1,0,61,9
"DAS Gunaratne","Downdegedara Asela Sampath Gunaratne","Sri Lanka","t20s",12,12,225,84,3,25,183,122.95,2,0,19,6
"DN Wellalage","Dunith Nethmika Wellalage","Sri Lanka","t20s",9,9,93,29,4,18.6,94,98.94,0,0,9,2
"EMDY Munaweera","Eldeniya Medagedara Dilshan Yasika Munaweera","Sri Lanka","t20s",13,13,215,53,1,17.92,172,125,1,0,25,7
"GSNFG Jayasuriya","Gampalage Shehan Naveendra De Fonseka Gunawarna Jayasuriya","Sri Lanka","t20s",16,16,241,40,0,15.06,228,105.7,0,0,20,8
"CU Jayasinghe","Halwathurage Chinthaka Umesh Jayasinghe","Sri Lanka","t20s",3,3,49,38,2,49,49,100,0,0,3,1
"HMCM Bandara","Herath Mudiyanselage Charitha Malinga Bandara","Sri Lanka","t20s",3,3,12,7,1,6,15,80,0,0,0,0
"HMRKB Herath","Herath Mudiyanselage Rangana Keerthi Bandara Herath","Sri Lanka","t20s",5,5,8,3,2,2.67,12,66.67,0,0,0,0
"HDRL Thirimanne","Hettige Don Rumesh Lahiru Thirimanne","Sri Lanka","t20s",19,19,285,44,3,17.81,256,111.33,0,0,26,5
"S Randiv","Hewa Kaluhalamullage Suraj Randiv Kaluhalamulla","Sri Lanka","t20s",2,2,8,6,0,4,6,133.33,0,0,1,0
"N Thushara","Ilandari Dewage Nuwan Thushara","Sri Lanka","t20s",8,8,4,2,8,4,24,16.67,0,0,0,0
"I Udana","Isuru Udana Tillakaratna","Sri Lanka","t20s",24,24,256,84,10,18.29,191,134.03,1,0,16,14
"JRMVB Sanjaya","Jayasundara Ranasinghe Mudiyanselage Vikum Bandara Sanjaya","Sri Lanka","t20s",5,5,20,6,2,6.67,18,111.11,0,0,3,0
"JDF Vandersay","Jeffrey Dexter Francis Vandersay","Sri Lanka","t20s",7,7,35,8,4,11.67,42,83.33,0,0,3,1
"J Mubarak","Jehan Mubarak","Sri Lanka","t20s",14,14,221,46,4,22.1,175,126.29,0,0,19,8
"KIC Asalanka","Kariyawasam Indipalage Charith Asalanka","Sri Lanka","t20s",68,68,1415,80,9,23.98,1136,124.56,6,0,98,69
"KDK Vithanage","Kasun Disi Kithuruwan Vithanage","Sri Lanka","t20s",3,3,40,38,0,13.33,35,114.29,0,0,7,0
"KS Lokuarachchi","Kaushal Samaraweera Lokuarachchi","Sri Lanka","t20s",2,2,11,11,0,5.5,13,84.62,0,0,1,0
"K Weeraratne","Kaushalya Weeraratne","Sri Lanka","t20s",4,4,45,20,3,45,37,121.62,0,0,4,1
"E Malinga","Kiribathgala Kankanamalage Eshan Malinga Dharmasena","Sri Lanka","t20s",2,2,1,1,1,1,8,12.5,0,0,0,0
"KMC Bandara","Konara Mudiyanselage Chaminda Bandara","Sri Lanka","t20s",1,1,2,2,1,2,4,50,0,0,0,0
"J Liyanage","Kongala Liyanage Janith Vimukthi","Sri Lanka","t20s",13,13,181,41,5,22.62,179,101.12,0,0,13,3
"KNA Bandara","Koralegedera Nadeeja Ashen Bandara","Sri Lanka","t20s",4,4,84,44,1,28,82,102.44,0,0,4,3
"KMDN Kulasekara","Kulasekara Mudiyanselage Dinesh Nuwan Kulasekara","Sri Lanka","t20s",29,29,196,31,8,9.33,184,106.52,0,0,14,5
"KC Sangakkara","Kumar Chokshanada Sangakkara","Sri Lanka","t20s",53,53,1382,78,11,32.9,1193,115.84,8,0,139,20
"LD Madushanka","Lahiru Dilshan Madushanka","Sri Lanka","t20s",3,3,22,20,0,7.33,29,75.86,0,0,1,0
"LPC Silva","Lindamlilage Prageeth Chamara Silva","Sri Lanka","t20s",15,15,175,38,2,13.46,184,95.11,0,0,19,3
"LD Chandimal","Lokuge Dinesh Chandimal","Sri Lanka","t20s",61,61,1048,66,7,19.41,1032,101.55,6,0,89,21
"D Madushanka","Lokumarakkalage Dilshan Madushanka","Sri Lanka","t20s",4,4,1,1,0,0.25,7,14.29,0,0,0,0
"MD Shanaka","Madagamagamage Dasun Shanaka","Sri Lanka","t20s",112,112,1884,76,25,21.66,1535,122.74,8,0,126,105
"T Thushara","Magina Thilan Thushara Mirando","Sri Lanka","t20s",2,2,4,3,0,2,8,50,0,0,0,0
"A Dananjaya","Mahamarakkala Kurukulasooriya Patabendige Akila Dananjaya Perera","Sri Lanka","t20s",14,14,61,11,6,7.62,76,80.26,0,0,6,0
"MDK Perera","Mahawaduge Dilruwan Kamalaneth Perera","Sri Lanka","t20s",2,2,1,1,0,0.5,8,12.5,0,0,0,0
"ML Udawatte","Mahela Lakmal Udawatte","Sri Lanka","t20s",7,7,71,25,0,10.14,75,94.67,0,0,8,1
"MA Aponso","Malmeege Amila Aponso","Sri Lanka","t20s",1,1,0,0,0,0,2,0,0,0,0,0
"MS Atapattu","Marvan Samson Atapattu","Sri Lanka","t20s",1,1,5,5,0,5,8,62.5,0,0,0,0
"MD Gunathilaka","Mashtayage Danushka Gunathilaka","Sri Lanka","t20s",43,43,691,57,1,16.45,605,114.21,3,0,73,19
"M Pathirana","Matheesha Pathirana","Sri Lanka","t20s",9,9,9,6,4,1.8,21,42.86,0,0,1,0
"MDKJ Perera","Mathurage Don Kusal Janith Perera","Sri Lanka","t20s",91,91,2307,101,5,26.83,1803,127.95,16,1,224,72
"M Bhanuka","Minod Bhanuka Ranasinghe","Sri Lanka","t20s",4,4,64,36,0,16,71,90.14,0,0,7,0
"MF Maharoof","Mohamed Farveez Maharoof","Sri Lanka","t20s",4,4,20,10,0,5,33,60.61,0,0,0,0
"M Theekshana","Morawakage Maheesh Theekshana","Sri Lanka","t20s",34,34,105,14,13,5,171,61.4,0,0,6,2
"MADI Hemantha","Munasinghe Arachchige Dushan Ishara Hemantha","Sri Lanka","t20s",5,5,29,14,2,9.67,34,85.29,0,0,2,0
"M Muralitharan","Muthiah Muralidaran","Sri Lanka","t20s",2,2,1,1,0,0.5,5,20,0,0,0,0
"MNK Fernando","Muthuthanthirige Nuwanidu Keshawa Fernando","Sri Lanka","t20s",2,2,8,7,0,4,12,66.67,0,0,0,0
"MVT Fernando","Muthuthanthrige Vishwa Thilina Fernando","Sri Lanka","t20s",1,1,2,2,0,2,2,100,0,0,0,0
"NLTC Perera","Narangoda Liyanaarachchilage Thisara Chirantha Perera","Sri Lanka","t20s",72,72,1199,61,24,24.98,828,144.81,3,0,88,63
"PHKD Mendis","Pasqual Handi Kamindu Dilanka Mendis","Sri Lanka","t20s",36,36,581,51,2,17.09,486,119.55,2,0,48,24
"PVD Chameera","Pathira Vasan Dushmantha Chameera","Sri Lanka","t20s",35,35,116,24,13,5.27,155,74.84,0,0,9,1
"PADLR Sandakan","Paththamperuma Arachchige Don Lakshan Rangika Sandakan","Sri Lanka","t20s",7,7,23,10,4,7.67,40,57.5,0,0,2,0
"P Nissanka","Pathum Nissanka Silva","Sri Lanka","t20s",83,83,2506,107,6,32.55,2035,123.14,18,2,250,73
"P Rathnayake","Pavan Rathnayake","Sri Lanka","t20s",10,10,266,60,1,29.56,185,143.78,2,0,27,7
"P Jayawickrama","Perumapperuma Arachchige Kaveesha Praveen Jayawickrama","Sri Lanka","t20s",1,1,0,0,1,0,5,0,0,0,0,0
"PC de Silva","Pinnaduwage Chaturanga de Silva","Sri Lanka","t20s",2,2,22,21,0,11,22,100,0,0,1,0
"PWH de Silva","Pinnaduwage Wanindu Hasaranga de Silva","Sri Lanka","t20s",72,72,687,71,19,12.96,580,118.45,1,0,68,12
"PBB Rajapaksa","Pramod Bhanuka Bandara Rajapaksa","Sri Lanka","t20s",37,37,657,77,7,21.9,527,124.67,3,0,52,29
"PM Liyanagamage","Pramod Madushan Liyanagamage","Sri Lanka","t20s",2,2,2,1,1,2,4,50,0,0,0,0
"K Mishara","Rajapaksha Vidana Pathiranalage Kamil Mishara","Sri Lanka","t20s",21,21,473,76,2,24.89,377,125.46,3,0,45,20
"RLB Rambukwella","Ramith Laksen Bandara Rambukwella","Sri Lanka","t20s",1,1,19,19,0,19,16,118.75,0,0,1,1
"RAS Lakmal","Ranasinghe Arachchige Suranga Lakmal","Sri Lanka","t20s",5,5,7,5,2,2.33,11,63.64,0,0,1,0
"RMS Eranga","Ranaweera Mudiyanselage Shaminda Eranga","Sri Lanka","t20s",1,1,6,6,0,6,8,75,0,0,1,0
"RJMGM Rupasinghe","Rupasinghe Jayawardene Mudiyanselage Gihan Madushanka Rupasinghe","Sri Lanka","t20s",2,2,33,18,0,16.5,39,84.62,0,0,2,0
"RP Arnold","Russel Premakumaran Arnold","Sri Lanka","t20s",1,1,7,7,0,7,8,87.5,0,0,0,0
"SS Pathirana","Sachith Shanaka Pathirana","Sri Lanka","t20s",5,5,27,14,0,5.4,26,103.85,0,0,3,0
"SHT Kandamby","Sahan Hewa Thilina Kandamby","Sri Lanka","t20s",2,2,12,10,0,6,18,66.67,0,0,0,0
"ST de Silva","Sammu Nirwantha Thikshila de Silva","Sri Lanka","t20s",2,2,3,3,0,1.5,7,42.86,0,0,0,0
"ST Jayasuriya","Sanath Teran Jayasuriya","Sri Lanka","t20s",28,28,615,88,2,23.65,495,124.24,4,0,75,22
"S Prasanna","Seekkuge Prasanna","Sri Lanka","t20s",20,20,214,37,6,15.29,176,121.59,0,0,13,13
"SMSM Senanayake","Senanayake Mudiyanselage Sachithra Madhushanka Senanayake","Sri Lanka","t20s",11,11,56,17,5,9.33,69,81.16,0,0,3,1
"SL Malinga","Separamadu Lasith Malinga","Sri Lanka","t20s",31,31,136,27,11,6.8,164,82.93,0,0,9,5
"S Ravikumar","Sharina Ravikumar","Sri Lanka","t20s",7,7,89,52,0,12.71,141,63.12,1,0,5,1
"SMA Priyanjan","Subasinghe Mudiyanselage Ashan Priyanjan","Sri Lanka","t20s",3,3,54,40,2,54,63,85.71,0,0,1,2
"TM Dilshan","Tillakaratne Mudiyanselage Dilshan","Sri Lanka","t20s",75,75,1747,104,12,27.73,1497,116.7,12,1,210,29
"TAM Siriwardana","Tisse Appuhamilage Milinda Siriwardana","Sri Lanka","t20s",19,19,275,42,3,17.19,217,126.73,0,0,16,12
"UWMBCA Welegedara","Uda Walawwe Mahim Bandaralage Chanaka Asanga Welegedara","Sri Lanka","t20s",1,1,2,2,1,2,3,66.67,0,0,0,0
"V Viyaskanth","Vijayakanth Viyaskanth","Sri Lanka","t20s",1,1,0,0,1,0,2,0,0,0,0,0
"RTM Mendis","Wanigamuni Ramesh Tarinda Mendis","Sri Lanka","t20s",3,3,17,12,0,5.67,24,70.83,0,0,0,1
"WPUJC Vaas","Warnakulasuriya Patabendige Ushantha Joseph Chaminda Vaas","Sri Lanka","t20s",2,2,33,21,1,33,42,78.57,0,0,1,0
"WU Tharanga","Warushavithana Upul Tharanga","Sri Lanka","t20s",26,26,407,47,1,16.28,348,116.95,0,0,42,12
"S Samarawickrama","Wedagedara Sadeera Rashen Samarawickrama","Sri Lanka","t20s",15,15,211,61,2,16.23,212,99.53,1,0,23,1
"WIA Fernando","Weerahandige Inol Avishka Fernando","Sri Lanka","t20s",37,37,377,37,3,11.09,421,89.55,0,0,28,8
"G Wijekoon","Wijekoon Mudiyanselage Gayan Ramyakumara","Sri Lanka","t20s",2,2,1,1,1,1,6,16.67,0,0,0,0
